[
  {
    "build_id": "fixture-build-driving-loop",
    "place_id": "FixtureDlBrackenfordInn",
    "fetched_at": "2027-06-01T12:00:00.000Z",
    "location": {
      "lat": 41.2,
      "lng": -40.5
    },
    "content": {
      "display_name": "Brackenford Inn",
      "address": "2 Mill Street, Brackenford, Isle of Carrow, Fictional Isles",
      "business_status": "OPERATIONAL",
      "hours": {
        "weekday_descriptions": [
          "Monday: Open 24 hours",
          "Tuesday: Open 24 hours",
          "Wednesday: Open 24 hours",
          "Thursday: Open 24 hours",
          "Friday: Open 24 hours",
          "Saturday: Open 24 hours",
          "Sunday: Open 24 hours"
        ],
        "periods": [
          {
            "open": {
              "day": 0,
              "hour": 0,
              "minute": 0
            }
          }
        ]
      },
      "current_hours": null,
      "rating": 4.4,
      "review_count": 300,
      "website": "https://brackenford-inn.example.com/",
      "maps_uri": "https://maps.example.com/fixture/brackenford-inn",
      "time_zone": "Etc/GMT+3"
    }
  },
  {
    "build_id": "fixture-build-driving-loop",
    "place_id": "FixtureDlGullhavenLodge",
    "fetched_at": "2027-06-01T12:00:00.000Z",
    "location": {
      "lat": 41.42,
      "lng": -40.18
    },
    "content": {
      "display_name": "Gullhaven Lodge",
      "address": "Harbour Road, Gullhaven, Isle of Carrow, Fictional Isles",
      "business_status": "OPERATIONAL",
      "hours": {
        "weekday_descriptions": [
          "Monday: Open 24 hours",
          "Tuesday: Open 24 hours",
          "Wednesday: Open 24 hours",
          "Thursday: Open 24 hours",
          "Friday: Open 24 hours",
          "Saturday: Open 24 hours",
          "Sunday: Open 24 hours"
        ],
        "periods": [
          {
            "open": {
              "day": 0,
              "hour": 0,
              "minute": 0
            }
          }
        ]
      },
      "current_hours": null,
      "rating": 4.4,
      "review_count": 300,
      "website": "https://gullhaven-lodge.example.com/",
      "maps_uri": "https://maps.example.com/fixture/gullhaven-lodge",
      "time_zone": "Etc/GMT+3"
    }
  },
  {
    "build_id": "fixture-build-driving-loop",
    "place_id": "FixtureDlMarrowBayHotel",
    "fetched_at": "2027-06-01T12:00:00.000Z",
    "location": {
      "lat": 41.15,
      "lng": -39.9
    },
    "content": {
      "display_name": "Marrow Bay Hotel",
      "address": "1 Strand, Marrow Bay, Isle of Carrow, Fictional Isles",
      "business_status": "OPERATIONAL",
      "hours": {
        "weekday_descriptions": [
          "Monday: Open 24 hours",
          "Tuesday: Open 24 hours",
          "Wednesday: Open 24 hours",
          "Thursday: Open 24 hours",
          "Friday: Open 24 hours",
          "Saturday: Open 24 hours",
          "Sunday: Open 24 hours"
        ],
        "periods": [
          {
            "open": {
              "day": 0,
              "hour": 0,
              "minute": 0
            }
          }
        ]
      },
      "current_hours": null,
      "rating": 4.4,
      "review_count": 300,
      "website": "https://marrow-bay-hotel.example.com/",
      "maps_uri": "https://maps.example.com/fixture/marrow-bay-hotel",
      "time_zone": "Etc/GMT+3"
    }
  },
  {
    "build_id": "fixture-build-driving-loop",
    "place_id": "FixtureDlBrackenfordOldMill",
    "fetched_at": "2027-06-01T12:00:00.000Z",
    "location": {
      "lat": 41.2046,
      "lng": -40.4931
    },
    "content": {
      "display_name": "Brackenford Old Mill",
      "address": "Brackenford Old Mill, Isle of Carrow, Fictional Isles",
      "business_status": "OPERATIONAL",
      "hours": {
        "weekday_descriptions": [
          "Monday: Closed",
          "Tuesday: 10:00 AM – 5:00 PM",
          "Wednesday: 10:00 AM – 5:00 PM",
          "Thursday: 10:00 AM – 5:00 PM",
          "Friday: 10:00 AM – 5:00 PM",
          "Saturday: 10:00 AM – 5:00 PM",
          "Sunday: 10:00 AM – 5:00 PM"
        ],
        "periods": [
          {
            "open": {
              "day": 0,
              "hour": 10,
              "minute": 0
            },
            "close": {
              "day": 0,
              "hour": 17,
              "minute": 0
            }
          },
          {
            "open": {
              "day": 2,
              "hour": 10,
              "minute": 0
            },
            "close": {
              "day": 2,
              "hour": 17,
              "minute": 0
            }
          },
          {
            "open": {
              "day": 3,
              "hour": 10,
              "minute": 0
            },
            "close": {
              "day": 3,
              "hour": 17,
              "minute": 0
            }
          },
          {
            "open": {
              "day": 4,
              "hour": 10,
              "minute": 0
            },
            "close": {
              "day": 4,
              "hour": 17,
              "minute": 0
            }
          },
          {
            "open": {
              "day": 5,
              "hour": 10,
              "minute": 0
            },
            "close": {
              "day": 5,
              "hour": 17,
              "minute": 0
            }
          },
          {
            "open": {
              "day": 6,
              "hour": 10,
              "minute": 0
            },
            "close": {
              "day": 6,
              "hour": 17,
              "minute": 0
            }
          }
        ]
      },
      "current_hours": null,
      "rating": 4.4,
      "review_count": 610,
      "website": "https://brackenford-old-mill.example.com/",
      "maps_uri": "https://maps.example.com/fixture/brackenford-old-mill",
      "time_zone": "Etc/GMT+3"
    }
  },
  {
    "build_id": "fixture-build-driving-loop",
    "place_id": "FixtureDlBrackenfordHarbourMarket",
    "fetched_at": "2027-06-01T12:00:00.000Z",
    "location": {
      "lat": 41.1978,
      "lng": -40.5036
    },
    "content": {
      "display_name": "Brackenford Harbour Market",
      "address": "Brackenford Harbour Market, Isle of Carrow, Fictional Isles",
      "business_status": "OPERATIONAL",
      "hours": {
        "weekday_descriptions": [
          "Monday: Closed",
          "Tuesday: 8:00 AM – 1:00 PM",
          "Wednesday: Closed",
          "Thursday: 8:00 AM – 1:00 PM",
          "Friday: Closed",
          "Saturday: 8:00 AM – 1:00 PM",
          "Sunday: Closed"
        ],
        "periods": [
          {
            "open": {
              "day": 2,
              "hour": 8,
              "minute": 0
            },
            "close": {
              "day": 2,
              "hour": 13,
              "minute": 0
            }
          },
          {
            "open": {
              "day": 4,
              "hour": 8,
              "minute": 0
            },
            "close": {
              "day": 4,
              "hour": 13,
              "minute": 0
            }
          },
          {
            "open": {
              "day": 6,
              "hour": 8,
              "minute": 0
            },
            "close": {
              "day": 6,
              "hour": 13,
              "minute": 0
            }
          }
        ]
      },
      "current_hours": null,
      "rating": 4.3,
      "review_count": 380,
      "website": "https://brackenford-harbour-market.example.com/",
      "maps_uri": "https://maps.example.com/fixture/brackenford-harbour-market",
      "time_zone": "Etc/GMT+3"
    }
  },
  {
    "build_id": "fixture-build-driving-loop",
    "place_id": "FixtureDlBrackenfordBakery",
    "fetched_at": "2027-06-01T12:00:00.000Z",
    "location": {
      "lat": 41.2012,
      "lng": -40.4985
    },
    "content": {
      "display_name": "Brackenford Bakery",
      "address": "Brackenford Bakery, Isle of Carrow, Fictional Isles",
      "business_status": "OPERATIONAL",
      "hours": {
        "weekday_descriptions": [
          "Monday: 7:00 AM – 3:00 PM",
          "Tuesday: 7:00 AM – 3:00 PM",
          "Wednesday: 7:00 AM – 3:00 PM",
          "Thursday: 7:00 AM – 3:00 PM",
          "Friday: 7:00 AM – 3:00 PM",
          "Saturday: 7:00 AM – 3:00 PM",
          "Sunday: 7:00 AM – 3:00 PM"
        ],
        "periods": [
          {
            "open": {
              "day": 0,
              "hour": 7,
              "minute": 0
            },
            "close": {
              "day": 0,
              "hour": 15,
              "minute": 0
            }
          },
          {
            "open": {
              "day": 1,
              "hour": 7,
              "minute": 0
            },
            "close": {
              "day": 1,
              "hour": 15,
              "minute": 0
            }
          },
          {
            "open": {
              "day": 2,
              "hour": 7,
              "minute": 0
            },
            "close": {
              "day": 2,
              "hour": 15,
              "minute": 0
            }
          },
          {
            "open": {
              "day": 3,
              "hour": 7,
              "minute": 0
            },
            "close": {
              "day": 3,
              "hour": 15,
              "minute": 0
            }
          },
          {
            "open": {
              "day": 4,
              "hour": 7,
              "minute": 0
            },
            "close": {
              "day": 4,
              "hour": 15,
              "minute": 0
            }
          },
          {
            "open": {
              "day": 5,
              "hour": 7,
              "minute": 0
            },
            "close": {
              "day": 5,
              "hour": 15,
              "minute": 0
            }
          },
          {
            "open": {
              "day": 6,
              "hour": 7,
              "minute": 0